=== GRAB NETWORK REPORT ===
Run Date: Mon Mar 30 12:10:29 UTC 2026
---------------------------
Frame 1: 80 bytes on wire (640 bits), 80 bytes captured (640 bits)
    Encapsulation type: Linux cooked-mode capture v2 (210)
    Arrival Time: Mar 30, 2026 12:10:23.558005000 UTC
    UTC Arrival Time: Mar 30, 2026 12:10:23.558005000 UTC
    Epoch Arrival Time: 1774872623.558005000
    [Time shift for this packet: 0.000000000 seconds]
    [Time delta from previous captured frame: 0.000000000 seconds]
    [Time delta from previous displayed frame: 0.000000000 seconds]
    [Time since reference or first frame: 0.000000000 seconds]
    Frame Number: 1
    Frame Length: 80 bytes (640 bits)
    Capture Length: 80 bytes (640 bits)
    [Frame is marked: False]
    [Frame is ignored: False]
    [Protocols in frame: sll:ethertype:ip:tcp]
Linux cooked capture v2
    Protocol: IPv4 (0x0800)
    Interface index: 2
    Link-layer address type: Ethernet (1)
    Packet type: Sent by us (4)
    Link-layer address length: 6
    Source: Microsoft_55:4a:a4 (7c:ed:8d:55:4a:a4)
    Unused: 0000
Internet Protocol Version 4, Src: 10.1.1.152, Dst: 3.0.108.130
    0100 .... = Version: 4
    .... 0101 = Header Length: 20 bytes (5)
    Differentiated Services Field: 0x00 (DSCP: CS0, ECN: Not-ECT)
        0000 00.. = Differentiated Services Codepoint: Default (0)
        .... ..00 = Explicit Congestion Notification: Not ECN-Capable Transport (0)
    Total Length: 60
    Identification: 0xde83 (56963)
    010. .... = Flags: 0x2, Don't fragment
        0... .... = Reserved bit: Not set
        .1.. .... = Don't fragment: Set
        ..0. .... = More fragments: Not set
    ...0 0000 0000 0000 = Fragment Offset: 0
    Time to Live: 64
    Protocol: TCP (6)
    Header Checksum: 0xe11d [validation disabled]
    [Header checksum status: Unverified]
    Source Address: 10.1.1.152
    Destination Address: 3.0.108.130
Transmission Control Protocol, Src Port: 36370, Dst Port: 443, Seq: 0, Len: 0
    Source Port: 36370
    Destination Port: 443
    [Stream index: 0]
    [Conversation completeness: Incomplete (0)]
        ..0. .... = RST: Absent
        ...0 .... = FIN: Absent
        .... 0... = Data: Absent
        .... .0.. = ACK: Absent
        .... ..0. = SYN-ACK: Absent
        .... ...0 = SYN: Absent
        [Completeness Flags: [ Null ]]
    [TCP Segment Len: 0]
    Sequence Number: 0    (relative sequence number)
    Sequence Number (raw): 2036428819
    [Next Sequence Number: 1    (relative sequence number)]
    Acknowledgment Number: 0
    Acknowledgment number (raw): 0
    1010 .... = Header Length: 40 bytes (10)
    Flags: 0x002 (SYN)
        000. .... .... = Reserved: Not set
        ...0 .... .... = Accurate ECN: Not set
        .... 0... .... = Congestion Window Reduced: Not set
        .... .0.. .... = ECN-Echo: Not set
        .... ..0. .... = Urgent: Not set
        .... ...0 .... = Acknowledgment: Not set
        .... .... 0... = Push: Not set
        .... .... .0.. = Reset: Not set
        .... .... ..1. = Syn: Set
            [Expert Info (Chat/Sequence): Connection establish request (SYN): server port 443]
                [Connection establish request (SYN): server port 443]
                [Severity level: Chat]
                [Group: Sequence]
        .... .... ...0 = Fin: Not set
        [TCP Flags: ··········S·]
    Window: 64240
    [Calculated window size: 64240]
    Checksum: 0x7b49 [unverified]
    [Checksum Status: Unverified]
    Urgent Pointer: 0
    Options: (20 bytes), Maximum segment size, SACK permitted, Timestamps, No-Operation (NOP), Window scale
        TCP Option - Maximum segment size: 1460 bytes
            Kind: Maximum Segment Size (2)
            Length: 4
            MSS Value: 1460
        TCP Option - SACK permitted
            Kind: SACK Permitted (4)
            Length: 2
        TCP Option - Timestamps
            Kind: Time Stamp Option (8)
            Length: 10
            Timestamp value: 2254932154: TSval 2254932154, TSecr 0
            Timestamp echo reply: 0
        TCP Option - No-Operation (NOP)
            Kind: No-Operation (1)
        TCP Option - Window scale: 10 (multiply by 1024)
            Kind: Window Scale (3)
            Length: 3
            Shift count: 10
            [Multiplier: 1024]
    [Timestamps]
        [Time since first frame in this TCP stream: 0.000000000 seconds]
        [Time since previous frame in this TCP stream: 0.000000000 seconds]

0000  08 00 00 00 00 00 00 02 00 01 04 06 7c ed 8d 55   ............|..U
0010  4a a4 00 00 45 00 00 3c de 83 40 00 40 06 e1 1d   J...E..<..@.@...
0020  0a 01 01 98 03 00 6c 82 8e 12 01 bb 79 61 70 13   ......l.....yap.
0030  00 00 00 00 a0 02 fa f0 7b 49 00 00 02 04 05 b4   ........{I......
0040  04 02 08 0a 86 67 88 ba 00 00 00 00 01 03 03 0a   .....g..........

Frame 2: 80 bytes on wire (640 bits), 80 bytes captured (640 bits)
    Encapsulation type: Linux cooked-mode capture v2 (210)
    Arrival Time: Mar 30, 2026 12:10:23.558026000 UTC
    UTC Arrival Time: Mar 30, 2026 12:10:23.558026000 UTC
    Epoch Arrival Time: 1774872623.558026000
    [Time shift for this packet: 0.000000000 seconds]
    [Time delta from previous captured frame: 0.000021000 seconds]
    [Time delta from previous displayed frame: 0.000021000 seconds]
    [Time since reference or first frame: 0.000021000 seconds]
    Frame Number: 2
    Frame Length: 80 bytes (640 bits)
    Capture Length: 80 bytes (640 bits)
    [Frame is marked: False]
    [Frame is ignored: False]
    [Protocols in frame: sll:ethertype:ip:tcp]
Linux cooked capture v2
    Protocol: IPv4 (0x0800)
    Interface index: 3
    Link-layer address type: Ethernet (1)
    Packet type: Sent by us (4)
    Link-layer address length: 6
    Source: Microsoft_55:4a:a4 (7c:ed:8d:55:4a:a4)
    Unused: 0000
Internet Protocol Version 4, Src: 10.1.1.152, Dst: 3.0.108.130
    0100 .... = Version: 4
    .... 0101 = Header Length: 20 bytes (5)
    Differentiated Services Field: 0x00 (DSCP: CS0, ECN: Not-ECT)
        0000 00.. = Differentiated Services Codepoint: Default (0)
        .... ..00 = Explicit Congestion Notification: Not ECN-Capable Transport (0)
    Total Length: 60
    Identification: 0xde83 (56963)
    010. .... = Flags: 0x2, Don't fragment
        0... .... = Reserved bit: Not set
        .1.. .... = Don't fragment: Set
        ..0. .... = More fragments: Not set
    ...0 0000 0000 0000 = Fragment Offset: 0
    Time to Live: 64
    Protocol: TCP (6)
    Header Checksum: 0xe11d [validation disabled]
    [Header checksum status: Unverified]
    Source Address: 10.1.1.152
    Destination Address: 3.0.108.130
Transmission Control Protocol, Src Port: 36370, Dst Port: 443, Seq: 0, Len: 0
    Source Port: 36370
    Destination Port: 443
    [Stream index: 0]
    [Conversation completeness: Incomplete, SYN_SENT (1)]
        ..0. .... = RST: Absent
        ...0 .... = FIN: Absent
        .... 0... = Data: Absent
        .... .0.. = ACK: Absent
        .... ..0. = SYN-ACK: Absent
        .... ...1 = SYN: Present
        [Completeness Flags: ·····S]
    [TCP Segment Len: 0]
    Sequence Number: 0    (relative sequence number)
    Sequence Number (raw): 2036428819
    [Next Sequence Number: 1    (relative sequence number)]
    Acknowledgment Number: 0
    Acknowledgment number (raw): 0
    1010 .... = Header Length: 40 bytes (10)
    Flags: 0x002 (SYN)
        000. .... .... = Reserved: Not set
        ...0 .... .... = Accurate ECN: Not set
        .... 0... .... = Congestion Window Reduced: Not set
        .... .0.. .... = ECN-Echo: Not set
        .... ..0. .... = Urgent: Not set
        .... ...0 .... = Acknowledgment: Not set
        .... .... 0... = Push: Not set
        .... .... .0.. = Reset: Not set
        .... .... ..1. = Syn: Set
            [Expert Info (Chat/Sequence): Connection establish request (SYN): server port 443]
                [Connection establish request (SYN): server port 443]
                [Severity level: Chat]
                [Group: Sequence]
        .... .... ...0 = Fin: Not set
        [TCP Flags: ··········S·]
    Window: 64240
    [Calculated window size: 64240]
    Checksum: 0x7b49 [unverified]
    [Checksum Status: Unverified]
    Urgent Pointer: 0
    Options: (20 bytes), Maximum segment size, SACK permitted, Timestamps, No-Operation (NOP), Window scale
        TCP Option - Maximum segment size: 1460 bytes
            Kind: Maximum Segment Size (2)
            Length: 4
            MSS Value: 1460
        TCP Option - SACK permitted
            Kind: SACK Permitted (4)
            Length: 2
        TCP Option - Timestamps
            Kind: Time Stamp Option (8)
            Length: 10
            Timestamp value: 2254932154: TSval 2254932154, TSecr 0
            Timestamp echo reply: 0
        TCP Option - No-Operation (NOP)
            Kind: No-Operation (1)
        TCP Option - Window scale: 10 (multiply by 1024)
            Kind: Window Scale (3)
            Length: 3
            Shift count: 10
            [Multiplier: 1024]
    [Timestamps]
        [Time since first frame in this TCP stream: 0.000021000 seconds]
        [Time since previous frame in this TCP stream: 0.000021000 seconds]
    [SEQ/ACK analysis]
        [TCP Analysis Flags]
            [Expert Info (Note/Sequence): This frame is a (suspected) retransmission]
                [This frame is a (suspected) retransmission]
                [Severity level: Note]
                [Group: Sequence]
            [The RTO for this segment was: 0.000021000 seconds]
            [RTO based on delta from frame: 1]

0000  08 00 00 00 00 00 00 03 00 01 04 06 7c ed 8d 55   ............|..U
0010  4a a4 00 00 45 00 00 3c de 83 40 00 40 06 e1 1d   J...E..<..@.@...
0020  0a 01 01 98 03 00 6c 82 8e 12 01 bb 79 61 70 13   ......l.....yap.
0030  00 00 00 00 a0 02 fa f0 7b 49 00 00 02 04 05 b4   ........{I......
0040  04 02 08 0a 86 67 88 ba 00 00 00 00 01 03 03 0a   .....g..........

Frame 3: 80 bytes on wire (640 bits), 80 bytes captured (640 bits)
    Encapsulation type: Linux cooked-mode capture v2 (210)
    Arrival Time: Mar 30, 2026 12:10:23.765484000 UTC
    UTC Arrival Time: Mar 30, 2026 12:10:23.765484000 UTC
    Epoch Arrival Time: 1774872623.765484000
    [Time shift for this packet: 0.000000000 seconds]
    [Time delta from previous captured frame: 0.207458000 seconds]
    [Time delta from previous displayed frame: 0.207458000 seconds]
    [Time since reference or first frame: 0.207479000 seconds]
    Frame Number: 3
    Frame Length: 80 bytes (640 bits)
    Capture Length: 80 bytes (640 bits)
    [Frame is marked: False]
    [Frame is ignored: False]
    [Protocols in frame: sll:ethertype:ip:tcp]
Linux cooked capture v2
    Protocol: IPv4 (0x0800)
    Interface index: 3
    Link-layer address type: Ethernet (1)
    Packet type: Unicast to us (0)
    Link-layer address length: 6
    Source: 12:34:56:78:9a:bc (12:34:56:78:9a:bc)
    Unused: 0000
Internet Protocol Version 4, Src: 3.0.108.130, Dst: 10.1.1.152
    0100 .... = Version: 4
    .... 0101 = Header Length: 20 bytes (5)
    Differentiated Services Field: 0x00 (DSCP: CS0, ECN: Not-ECT)
        0000 00.. = Differentiated Services Codepoint: Default (0)
        .... ..00 = Explicit Congestion Notification: Not ECN-Capable Transport (0)
    Total Length: 60
    Identification: 0x0000 (0)
    010. .... = Flags: 0x2, Don't fragment
        0... .... = Reserved bit: Not set
        .1.. .... = Don't fragment: Set
        ..0. .... = More fragments: Not set
    ...0 0000 0000 0000 = Fragment Offset: 0
    Time to Live: 236
    Protocol: TCP (6)
    Header Checksum: 0x13a1 [validation disabled]
    [Header checksum status: Unverified]
    Source Address: 3.0.108.130
    Destination Address: 10.1.1.152
Transmission Control Protocol, Src Port: 443, Dst Port: 36370, Seq: 0, Ack: 1, Len: 0
    Source Port: 443
    Destination Port: 36370
    [Stream index: 0]
    [Conversation completeness: Incomplete, SYN_SENT (1)]
        ..0. .... = RST: Absent
        ...0 .... = FIN: Absent
        .... 0... = Data: Absent
        .... .0.. = ACK: Absent
        .... ..0. = SYN-ACK: Absent
        .... ...1 = SYN: Present
        [Completeness Flags: ·····S]
    [TCP Segment Len: 0]
    Sequence Number: 0    (relative sequence number)
    Sequence Number (raw): 1936952573
    [Next Sequence Number: 1    (relative sequence number)]
    Acknowledgment Number: 1    (relative ack number)
    Acknowledgment number (raw): 2036428820
    1010 .... = Header Length: 40 bytes (10)
    Flags: 0x012 (SYN, ACK)
        000. .... .... = Reserved: Not set
        ...0 .... .... = Accurate ECN: Not set
        .... 0... .... = Congestion Window Reduced: Not set
        .... .0.. .... = ECN-Echo: Not set
        .... ..0. .... = Urgent: Not set
        .... ...1 .... = Acknowledgment: Set
        .... .... 0... = Push: Not set
        .... .... .0.. = Reset: Not set
        .... .... ..1. = Syn: Set
            [Expert Info (Chat/Sequence): Connection establish acknowledge (SYN+ACK): server port 443]
                [Connection establish acknowledge (SYN+ACK): server port 443]
                [Severity level: Chat]
                [Group: Sequence]
        .... .... ...0 = Fin: Not set
        [TCP Flags: ·······A··S·]
    Window: 26847
    [Calculated window size: 26847]
    Checksum: 0x7fe3 [unverified]
    [Checksum Status: Unverified]
    Urgent Pointer: 0
    Options: (20 bytes), Maximum segment size, SACK permitted, Timestamps, No-Operation (NOP), Window scale
        TCP Option - Maximum segment size: 1460 bytes
            Kind: Maximum Segment Size (2)
            Length: 4
            MSS Value: 1460
        TCP Option - SACK permitted
            Kind: SACK Permitted (4)
            Length: 2
        TCP Option - Timestamps
            Kind: Time Stamp Option (8)
            Length: 10
            Timestamp value: 4111033905: TSval 4111033905, TSecr 2254932154
            Timestamp echo reply: 2254932154
        TCP Option - No-Operation (NOP)
            Kind: No-Operation (1)
        TCP Option - Window scale: 8 (multiply by 256)
            Kind: Window Scale (3)
            Length: 3
            Shift count: 8
            [Multiplier: 256]
    [Timestamps]
        [Time since first frame in this TCP stream: 0.207479000 seconds]
        [Time since previous frame in this TCP stream: 0.207458000 seconds]
    [SEQ/ACK analysis]
        [This is an ACK to the segment in frame: 1]
        [The RTT to ACK the segment was: 0.207479000 seconds]

0000  08 00 00 00 00 00 00 03 00 01 00 06 12 34 56 78   .............4Vx
0010  9a bc 00 00 45 00 00 3c 00 00 40 00 ec 06 13 a1   ....E..<..@.....
0020  03 00 6c 82 0a 01 01 98 01 bb 8e 12 73 73 8c fd   ..l.........ss..
0030  79 61 70 14 a0 12 68 df 7f e3 00 00 02 04 05 b4   yap...h.........
0040  04 02 08 0a f5 09 66 31 86 67 88 ba 01 03 03 08   ......f1.g......

Frame 4: 80 bytes on wire (640 bits), 80 bytes captured (640 bits)
    Encapsulation type: Linux cooked-mode capture v2 (210)
    Arrival Time: Mar 30, 2026 12:10:23.765484000 UTC
    UTC Arrival Time: Mar 30, 2026 12:10:23.765484000 UTC
    Epoch Arrival Time: 1774872623.765484000
    [Time shift for this packet: 0.000000000 seconds]
    [Time delta from previous captured frame: 0.000000000 seconds]
    [Time delta from previous displayed frame: 0.000000000 seconds]
    [Time since reference or first frame: 0.207479000 seconds]
    Frame Number: 4
    Frame Length: 80 bytes (640 bits)
    Capture Length: 80 bytes (640 bits)
    [Frame is marked: False]
    [Frame is ignored: False]
    [Protocols in frame: sll:ethertype:ip:tcp]
Linux cooked capture v2
    Protocol: IPv4 (0x0800)
    Interface index: 2
    Link-layer address type: Ethernet (1)
    Packet type: Unicast to us (0)
    Link-layer address length: 6
    Source: 12:34:56:78:9a:bc (12:34:56:78:9a:bc)
    Unused: 0000
Internet Protocol Version 4, Src: 3.0.108.130, Dst: 10.1.1.152
    0100 .... = Version: 4
    .... 0101 = Header Length: 20 bytes (5)
    Differentiated Services Field: 0x00 (DSCP: CS0, ECN: Not-ECT)
        0000 00.. = Differentiated Services Codepoint: Default (0)
        .... ..00 = Explicit Congestion Notification: Not ECN-Capable Transport (0)
    Total Length: 60
    Identification: 0x0000 (0)
    010. .... = Flags: 0x2, Don't fragment
        0... .... = Reserved bit: Not set
        .1.. .... = Don't fragment: Set
        ..0. .... = More fragments: Not set
    ...0 0000 0000 0000 = Fragment Offset: 0
    Time to Live: 236
    Protocol: TCP (6)
    Header Checksum: 0x13a1 [validation disabled]
    [Header checksum status: Unverified]
    Source Address: 3.0.108.130
    Destination Address: 10.1.1.152
Transmission Control Protocol, Src Port: 443, Dst Port: 36370, Seq: 0, Ack: 1, Len: 0
    Source Port: 443
    Destination Port: 36370
    [Stream index: 0]
    [Conversation completeness: Incomplete, CLIENT_ESTABLISHED (3)]
        ..0. .... = RST: Absent
        ...0 .... = FIN: Absent
        .... 0... = Data: Absent
        .... .0.. = ACK: Absent
        .... ..1. = SYN-ACK: Present
        .... ...1 = SYN: Present
        [Completeness Flags: ····SS]
    [TCP Segment Len: 0]
    Sequence Number: 0    (relative sequence number)
    Sequence Number (raw): 1936952573
    [Next Sequence Number: 1    (relative sequence number)]
    Acknowledgment Number: 1    (relative ack number)
    Acknowledgment number (raw): 2036428820
    1010 .... = Header Length: 40 bytes (10)
    Flags: 0x012 (SYN, ACK)
        000. .... .... = Reserved: Not set
        ...0 .... .... = Accurate ECN: Not set
        .... 0... .... = Congestion Window Reduced: Not set
        .... .0.. .... = ECN-Echo: Not set
        .... ..0. .... = Urgent: Not set
        .... ...1 .... = Acknowledgment: Set
        .... .... 0... = Push: Not set
        .... .... .0.. = Reset: Not set
        .... .... ..1. = Syn: Set
            [Expert Info (Chat/Sequence): Connection establish acknowledge (SYN+ACK): server port 443]
                [Connection establish acknowledge (SYN+ACK): server port 443]
                [Severity level: Chat]
                [Group: Sequence]
        .... .... ...0 = Fin: Not set
        [TCP Flags: ·······A··S·]
    Window: 26847
    [Calculated window size: 26847]
    Checksum: 0x7fe3 [unverified]
    [Checksum Status: Unverified]
    Urgent Pointer: 0
    Options: (20 bytes), Maximum segment size, SACK permitted, Timestamps, No-Operation (NOP), Window scale
        TCP Option - Maximum segment size: 1460 bytes
            Kind: Maximum Segment Size (2)
            Length: 4
            MSS Value: 1460
        TCP Option - SACK permitted
            Kind: SACK Permitted (4)
            Length: 2
        TCP Option - Timestamps
            Kind: Time Stamp Option (8)
            Length: 10
            Timestamp value: 4111033905: TSval 4111033905, TSecr 2254932154
            Timestamp echo reply: 2254932154
        TCP Option - No-Operation (NOP)
            Kind: No-Operation (1)
        TCP Option - Window scale: 8 (multiply by 256)
            Kind: Window Scale (3)
            Length: 3
            Shift count: 8
            [Multiplier: 256]
    [Timestamps]
        [Time since first frame in this TCP stream: 0.207479000 seconds]
        [Time since previous frame in this TCP stream: 0.000000000 seconds]
    [SEQ/ACK analysis]
        [TCP Analysis Flags]
            [Expert Info (Note/Sequence): This frame is a (suspected) retransmission]
                [This frame is a (suspected) retransmission]
                [Severity level: Note]
                [Group: Sequence]

0000  08 00 00 00 00 00 00 02 00 01 00 06 12 34 56 78   .............4Vx
0010  9a bc 00 00 45 00 00 3c 00 00 40 00 ec 06 13 a1   ....E..<..@.....
0020  03 00 6c 82 0a 01 01 98 01 bb 8e 12 73 73 8c fd   ..l.........ss..
0030  79 61 70 14 a0 12 68 df 7f e3 00 00 02 04 05 b4   yap...h.........
0040  04 02 08 0a f5 09 66 31 86 67 88 ba 01 03 03 08   ......f1.g......

Frame 5: 72 bytes on wire (576 bits), 72 bytes captured (576 bits)
    Encapsulation type: Linux cooked-mode capture v2 (210)
    Arrival Time: Mar 30, 2026 12:10:23.765532000 UTC
    UTC Arrival Time: Mar 30, 2026 12:10:23.765532000 UTC
    Epoch Arrival Time: 1774872623.765532000
    [Time shift for this packet: 0.000000000 seconds]
    [Time delta from previous captured frame: 0.000048000 seconds]
    [Time delta from previous displayed frame: 0.000048000 seconds]
    [Time since reference or first frame: 0.207527000 seconds]
    Frame Number: 5
    Frame Length: 72 bytes (576 bits)
    Capture Length: 72 bytes (576 bits)
    [Frame is marked: False]
    [Frame is ignored: False]
    [Protocols in frame: sll:ethertype:ip:tcp]
Linux cooked capture v2
    Protocol: IPv4 (0x0800)
    Interface index: 2
    Link-layer address type: Ethernet (1)
    Packet type: Sent by us (4)
    Link-layer address length: 6
    Source: Microsoft_55:4a:a4 (7c:ed:8d:55:4a:a4)
    Unused: 0000
Internet Protocol Version 4, Src: 10.1.1.152, Dst: 3.0.108.130
    0100 .... = Version: 4
    .... 0101 = Header Length: 20 bytes (5)
    Differentiated Services Field: 0x00 (DSCP: CS0, ECN: Not-ECT)
        0000 00.. = Differentiated Services Codepoint: Default (0)
        .... ..00 = Explicit Congestion Notification: Not ECN-Capable Transport (0)
    Total Length: 52
    Identification: 0xde84 (56964)
    010. .... = Flags: 0x2, Don't fragment
        0... .... = Reserved bit: Not set
        .1.. .... = Don't fragment: Set
        ..0. .... = More fragments: Not set
    ...0 0000 0000 0000 = Fragment Offset: 0
    Time to Live: 64
    Protocol: TCP (6)
    Header Checksum: 0xe124 [validation disabled]
    [Header checksum status: Unverified]
    Source Address: 10.1.1.152
    Destination Address: 3.0.108.130
Transmission Control Protocol, Src Port: 36370, Dst Port: 443, Seq: 1, Ack: 1, Len: 0
    Source Port: 36370
    Destination Port: 443
    [Stream index: 0]
    [Conversation completeness: Incomplete, CLIENT_ESTABLISHED (3)]
        ..0. .... = RST: Absent
        ...0 .... = FIN: Absent
        .... 0... = Data: Absent
        .... .0.. = ACK: Absent
        .... ..1. = SYN-ACK: Present
        .... ...1 = SYN: Present
        [Completeness Flags: ····SS]
    [TCP Segment Len: 0]
    Sequence Number: 1    (relative sequence number)
    Sequence Number (raw): 2036428820
    [Next Sequence Number: 1    (relative sequence number)]
    Acknowledgment Number: 1    (relative ack number)
    Acknowledgment number (raw): 1936952574
    1000 .... = Header Length: 32 bytes (8)
    Flags: 0x010 (ACK)
        000. .... .... = Reserved: Not set
        ...0 .... .... = Accurate ECN: Not set
        .... 0... .... = Congestion Window Reduced: Not set
        .... .0.. .... = ECN-Echo: Not set
        .... ..0. .... = Urgent: Not set
        .... ...1 .... = Acknowledgment: Set
        .... .... 0... = Push: Not set
        .... .... .0.. = Reset: Not set
        .... .... ..0. = Syn: Not set
        .... .... ...0 = Fin: Not set
        [TCP Flags: ·······A····]
    Window: 63
    [Calculated window size: 64512]
    [Window size scaling factor: 1024]
    Checksum: 0x7b41 [unverified]
    [Checksum Status: Unverified]
    Urgent Pointer: 0
    Options: (12 bytes), No-Operation (NOP), No-Operation (NOP), Timestamps
        TCP Option - No-Operation (NOP)
            Kind: No-Operation (1)
        TCP Option - No-Operation (NOP)
            Kind: No-Operation (1)
        TCP Option - Timestamps
            Kind: Time Stamp Option (8)
            Length: 10
            Timestamp value: 2254932362: TSval 2254932362, TSecr 4111033905
            Timestamp echo reply: 4111033905
    [Timestamps]
        [Time since first frame in this TCP stream: 0.207527000 seconds]
        [Time since previous frame in this TCP stream: 0.000048000 seconds]
    [SEQ/ACK analysis]
        [This is an ACK to the segment in frame: 3]
        [The RTT to ACK the segment was: 0.000048000 seconds]
        [iRTT: 0.207506000 seconds]

0000  08 00 00 00 00 00 00 02 00 01 04 06 7c ed 8d 55   ............|..U
0010  4a a4 00 00 45 00 00 34 de 84 40 00 40 06 e1 24   J...E..4..@.@..$
0020  0a 01 01 98 03 00 6c 82 8e 12 01 bb 79 61 70 14   ......l.....yap.
0030  73 73 8c fe 80 10 00 3f 7b 41 00 00 01 01 08 0a   ss.....?{A......
0040  86 67 89 8a f5 09 66 31                           .g....f1

Frame 6: 72 bytes on wire (576 bits), 72 bytes captured (576 bits)
    Encapsulation type: Linux cooked-mode capture v2 (210)
    Arrival Time: Mar 30, 2026 12:10:23.765535000 UTC
    UTC Arrival Time: Mar 30, 2026 12:10:23.765535000 UTC
    Epoch Arrival Time: 1774872623.765535000
    [Time shift for this packet: 0.000000000 seconds]
    [Time delta from previous captured frame: 0.000003000 seconds]
    [Time delta from previous displayed frame: 0.000003000 seconds]
    [Time since reference or first frame: 0.207530000 seconds]
    Frame Number: 6
    Frame Length: 72 bytes (576 bits)
    Capture Length: 72 bytes (576 bits)
    [Frame is marked: False]
    [Frame is ignored: False]
    [Protocols in frame: sll:ethertype:ip:tcp]
Linux cooked capture v2
    Protocol: IPv4 (0x0800)
    Interface index: 3
    Link-layer address type: Ethernet (1)
    Packet type: Sent by us (4)
    Link-layer address length: 6
    Source: Microsoft_55:4a:a4 (7c:ed:8d:55:4a:a4)
    Unused: 0000
Internet Protocol Version 4, Src: 10.1.1.152, Dst: 3.0.108.130
    0100 .... = Version: 4
    .... 0101 = Header Length: 20 bytes (5)
    Differentiated Services Field: 0x00 (DSCP: CS0, ECN: Not-ECT)
        0000 00.. = Differentiated Services Codepoint: Default (0)
        .... ..00 = Explicit Congestion Notification: Not ECN-Capable Transport (0)
    Total Length: 52
    Identification: 0xde84 (56964)
    010. .... = Flags: 0x2, Don't fragment
        0... .... = Reserved bit: Not set
        .1.. .... = Don't fragment: Set
        ..0. .... = More fragments: Not set
    ...0 0000 0000 0000 = Fragment Offset: 0
    Time to Live: 64
    Protocol: TCP (6)
    Header Checksum: 0xe124 [validation disabled]
    [Header checksum status: Unverified]
    Source Address: 10.1.1.152
    Destination Address: 3.0.108.130
Transmission Control Protocol, Src Port: 36370, Dst Port: 443, Seq: 1, Ack: 1, Len: 0
    Source Port: 36370
    Destination Port: 443
    [Stream index: 0]
    [Conversation completeness: Incomplete, ESTABLISHED (7)]
        ..0. .... = RST: Absent
        ...0 .... = FIN: Absent
        .... 0... = Data: Absent
        .... .1.. = ACK: Present
        .... ..1. = SYN-ACK: Present
        .... ...1 = SYN: Present
        [Completeness Flags: ···ASS]
    [TCP Segment Len: 0]
    Sequence Number: 1    (relative sequence number)
    Sequence Number (raw): 2036428820
    [Next Sequence Number: 1    (relative sequence number)]
    Acknowledgment Number: 1    (relative ack number)
    Acknowledgment number (raw): 1936952574
    1000 .... = Header Length: 32 bytes (8)
    Flags: 0x010 (ACK)
        000. .... .... = Reserved: Not set
        ...0 .... .... = Accurate ECN: Not set
        .... 0... .... = Congestion Window Reduced: Not set
        .... .0.. .... = ECN-Echo: Not set
        .... ..0. .... = Urgent: Not set
        .... ...1 .... = Acknowledgment: Set
        .... .... 0... = Push: Not set
        .... .... .0.. = Reset: Not set
        .... .... ..0. = Syn: Not set
        .... .... ...0 = Fin: Not set
        [TCP Flags: ·······A····]
    Window: 63
    [Calculated window size: 64512]
    [Window size scaling factor: 1024]
    Checksum: 0x7b41 [unverified]
    [Checksum Status: Unverified]
    Urgent Pointer: 0
    Options: (12 bytes), No-Operation (NOP), No-Operation (NOP), Timestamps
        TCP Option - No-Operation (NOP)
            Kind: No-Operation (1)
        TCP Option - No-Operation (NOP)
            Kind: No-Operation (1)
        TCP Option - Timestamps
            Kind: Time Stamp Option (8)
            Length: 10
            Timestamp value: 2254932362: TSval 2254932362, TSecr 4111033905
            Timestamp echo reply: 4111033905
    [Timestamps]
        [Time since first frame in this TCP stream: 0.207530000 seconds]
        [Time since previous frame in this TCP stream: 0.000003000 seconds]
    [SEQ/ACK analysis]
        [iRTT: 0.207506000 seconds]
        [TCP Analysis Flags]
            [This is a TCP duplicate ack]
        [Duplicate ACK #: 1]
        [Duplicate to the ACK in frame: 5]
            [Expert Info (Note/Sequence): Duplicate ACK (#1)]
                [Duplicate ACK (#1)]
                [Severity level: Note]
                [Group: Sequence]

0000  08 00 00 00 00 00 00 03 00 01 04 06 7c ed 8d 55   ............|..U
0010  4a a4 00 00 45 00 00 34 de 84 40 00 40 06 e1 24   J...E..4..@.@..$
0020  0a 01 01 98 03 00 6c 82 8e 12 01 bb 79 61 70 14   ......l.....yap.
0030  73 73 8c fe 80 10 00 3f 7b 41 00 00 01 01 08 0a   ss.....?{A......
0040  86 67 89 8a f5 09 66 31                           .g....f1

Frame 7: 589 bytes on wire (4712 bits), 589 bytes captured (4712 bits)
    Encapsulation type: Linux cooked-mode capture v2 (210)
    Arrival Time: Mar 30, 2026 12:10:23.786919000 UTC
    UTC Arrival Time: Mar 30, 2026 12:10:23.786919000 UTC
    Epoch Arrival Time: 1774872623.786919000
    [Time shift for this packet: 0.000000000 seconds]
    [Time delta from previous captured frame: 0.021384000 seconds]
    [Time delta from previous displayed frame: 0.021384000 seconds]
    [Time since reference or first frame: 0.228914000 seconds]
    Frame Number: 7
    Frame Length: 589 bytes (4712 bits)
    Capture Length: 589 bytes (4712 bits)
    [Frame is marked: False]
    [Frame is ignored: False]
    [Protocols in frame: sll:ethertype:ip:tcp:tls]
Linux cooked capture v2
    Protocol: IPv4 (0x0800)
    Interface index: 2
    Link-layer address type: Ethernet (1)
    Packet type: Sent by us (4)
    Link-layer address length: 6
    Source: Microsoft_55:4a:a4 (7c:ed:8d:55:4a:a4)
    Unused: 0000
Internet Protocol Version 4, Src: 10.1.1.152, Dst: 3.0.108.130
    0100 .... = Version: 4
    .... 0101 = Header Length: 20 bytes (5)
    Differentiated Services Field: 0x00 (DSCP: CS0, ECN: Not-ECT)
        0000 00.. = Differentiated Services Codepoint: Default (0)
        .... ..00 = Explicit Congestion Notification: Not ECN-Capable Transport (0)
    Total Length: 569
    Identification: 0xde85 (56965)
    010. .... = Flags: 0x2, Don't fragment
        0... .... = Reserved bit: Not set
        .1.. .... = Don't fragment: Set
        ..0. .... = More fragments: Not set
    ...0 0000 0000 0000 = Fragment Offset: 0
    Time to Live: 64
    Protocol: TCP (6)
    Header Checksum: 0xdf1e [validation disabled]
    [Header checksum status: Unverified]
    Source Address: 10.1.1.152
    Destination Address: 3.0.108.130
Transmission Control Protocol, Src Port: 36370, Dst Port: 443, Seq: 1, Ack: 1, Len: 517
    Source Port: 36370
    Destination Port: 443
    [Stream index: 0]
    [Conversation completeness: Incomplete, ESTABLISHED (7)]
        ..0. .... = RST: Absent
        ...0 .... = FIN: Absent
        .... 0... = Data: Absent
        .... .1.. = ACK: Present
        .... ..1. = SYN-ACK: Present
        .... ...1 = SYN: Present
        [Completeness Flags: ···ASS]
    [TCP Segment Len: 517]
    Sequence Number: 1    (relative sequence number)
    Sequence Number (raw): 2036428820
    [Next Sequence Number: 518    (relative sequence number)]
    Acknowledgment Number: 1    (relative ack number)
    Acknowledgment number (raw): 1936952574
    1000 .... = Header Length: 32 bytes (8)
    Flags: 0x018 (PSH, ACK)
        000. .... .... = Reserved: Not set
        ...0 .... .... = Accurate ECN: Not set
        .... 0... .... = Congestion Window Reduced: Not set
        .... .0.. .... = ECN-Echo: Not set
        .... ..0. .... = Urgent: Not set
        .... ...1 .... = Acknowledgment: Set
        .... .... 1... = Push: Set
        .... .... .0.. = Reset: Not set
        .... .... ..0. = Syn: Not set
        .... .... ...0 = Fin: Not set
        [TCP Flags: ·······AP···]
    Window: 63
    [Calculated window size: 64512]
    [Window size scaling factor: 1024]
    Checksum: 0x7d46 [unverified]
    [Checksum Status: Unverified]
    Urgent Pointer: 0
    Options: (12 bytes), No-Operation (NOP), No-Operation (NOP), Timestamps
        TCP Option - No-Operation (NOP)
            Kind: No-Operation (1)
        TCP Option - No-Operation (NOP)
            Kind: No-Operation (1)
        TCP Option - Timestamps
            Kind: Time Stamp Option (8)
            Length: 10
            Timestamp value: 2254932383: TSval 2254932383, TSecr 4111033905
            Timestamp echo reply: 4111033905
    [Timestamps]
        [Time since first frame in this TCP stream: 0.228914000 seconds]
        [Time since previous frame in this TCP stream: 0.021384000 seconds]
    [SEQ/ACK analysis]
        [iRTT: 0.207506000 seconds]
        [Bytes in flight: 517]
        [Bytes sent since last PSH flag: 517]
    TCP payload (517 bytes)
Transport Layer Security
    TLSv1 Record Layer: Handshake Protocol: Client Hello
        Content Type: Handshake (22)
        Version: TLS 1.0 (0x0301)
        Length: 512
        Handshake Protocol: Client Hello
            Handshake Type: Client Hello (1)
            Length: 508
            Version: TLS 1.2 (0x0303)
            Random: 406168e8f777e2a3a73c5adfd712c7b5458361b224c92119cba2bdb6a201459d
                GMT Unix Time: Mar 24, 2004 10:54:32.000000000 UTC
                Random Bytes: f777e2a3a73c5adfd712c7b5458361b224c92119cba2bdb6a201459d
            Session ID Length: 32
            Session ID: 26463016428d333d68e3d8c63be19dc4385b1fde039affe5ff3074751fb0f163
            Cipher Suites Length: 36
            Cipher Suites (18 suites)
                Cipher Suite: TLS_AES_256_GCM_SHA384 (0x1302)
                Cipher Suite: TLS_CHACHA20_POLY1305_SHA256 (0x1303)
                Cipher Suite: TLS_AES_128_GCM_SHA256 (0x1301)
                Cipher Suite: TLS_ECDHE_ECDSA_WITH_AES_256_GCM_SHA384 (0xc02c)
                Cipher Suite: TLS_ECDHE_RSA_WITH_AES_256_GCM_SHA384 (0xc030)
                Cipher Suite: TLS_ECDHE_ECDSA_WITH_AES_128_GCM_SHA256 (0xc02b)
                Cipher Suite: TLS_ECDHE_RSA_WITH_AES_128_GCM_SHA256 (0xc02f)
                Cipher Suite: TLS_ECDHE_ECDSA_WITH_CHACHA20_POLY1305_SHA256 (0xcca9)
                Cipher Suite: TLS_ECDHE_RSA_WITH_CHACHA20_POLY1305_SHA256 (0xcca8)
                Cipher Suite: TLS_ECDHE_ECDSA_WITH_AES_256_CBC_SHA384 (0xc024)
                Cipher Suite: TLS_ECDHE_RSA_WITH_AES_256_CBC_SHA384 (0xc028)
                Cipher Suite: TLS_ECDHE_ECDSA_WITH_AES_128_CBC_SHA256 (0xc023)
                Cipher Suite: TLS_ECDHE_RSA_WITH_AES_128_CBC_SHA256 (0xc027)
                Cipher Suite: TLS_DHE_RSA_WITH_AES_256_GCM_SHA384 (0x009f)
                Cipher Suite: TLS_DHE_RSA_WITH_AES_128_GCM_SHA256 (0x009e)
                Cipher Suite: TLS_DHE_RSA_WITH_AES_256_CBC_SHA256 (0x006b)
                Cipher Suite: TLS_DHE_RSA_WITH_AES_128_CBC_SHA256 (0x0067)
                Cipher Suite: TLS_EMPTY_RENEGOTIATION_INFO_SCSV (0x00ff)
            Compression Methods Length: 1
            Compression Methods (1 method)
                Compression Method: null (0)
            Extensions Length: 399
            Extension: server_name (len=29) name=mcd-gateway.grabtaxi.com
                Type: server_name (0)
                Length: 29
                Server Name Indication extension
                    Server Name list length: 27
                    Server Name Type: host_name (0)
                    Server Name length: 24
                    Server Name: mcd-gateway.grabtaxi.com
            Extension: ec_point_formats (len=4)
                Type: ec_point_formats (11)
                Length: 4
                EC point formats Length: 3
                Elliptic curves point formats (3)
                    EC point format: uncompressed (0)
                    EC point format: ansiX962_compressed_prime (1)
                    EC point format: ansiX962_compressed_char2 (2)
            Extension: supported_groups (len=22)
                Type: supported_groups (10)
                Length: 22
                Supported Groups List Length: 20
                Supported Groups (10 groups)
                    Supported Group: x25519 (0x001d)
                    Supported Group: secp256r1 (0x0017)
                    Supported Group: x448 (0x001e)
                    Supported Group: secp521r1 (0x0019)
                    Supported Group: secp384r1 (0x0018)
                    Supported Group: ffdhe2048 (0x0100)
                    Supported Group: ffdhe3072 (0x0101)
                    Supported Group: ffdhe4096 (0x0102)
                    Supported Group: ffdhe6144 (0x0103)
                    Supported Group: ffdhe8192 (0x0104)
            Extension: application_layer_protocol_negotiation (len=11)
                Type: application_layer_protocol_negotiation (16)
                Length: 11
                ALPN Extension Length: 9
                ALPN Protocol
                    ALPN string length: 8
                    ALPN Next Protocol: http/1.1
            Extension: encrypt_then_mac (len=0)
                Type: encrypt_then_mac (22)
                Length: 0
            Extension: extended_master_secret (len=0)
                Type: extended_master_secret (23)
                Length: 0
            Extension: post_handshake_auth (len=0)
                Type: post_handshake_auth (49)
                Length: 0
            Extension: signature_algorithms (len=42)
                Type: signature_algorithms (13)
                Length: 42
                Signature Hash Algorithms Length: 40
                Signature Hash Algorithms (20 algorithms)
                    Signature Algorithm: ecdsa_secp256r1_sha256 (0x0403)
                        Signature Hash Algorithm Hash: SHA256 (4)
                        Signature Hash Algorithm Signature: ECDSA (3)
                    Signature Algorithm: ecdsa_secp384r1_sha384 (0x0503)
                        Signature Hash Algorithm Hash: SHA384 (5)
                        Signature Hash Algorithm Signature: ECDSA (3)
                    Signature Algorithm: ecdsa_secp521r1_sha512 (0x0603)
                        Signature Hash Algorithm Hash: SHA512 (6)
                        Signature Hash Algorithm Signature: ECDSA (3)
                    Signature Algorithm: ed25519 (0x0807)
                        Signature Hash Algorithm Hash: Unknown (8)
                        Signature Hash Algorithm Signature: Unknown (7)
                    Signature Algorithm: ed448 (0x0808)
                        Signature Hash Algorithm Hash: Unknown (8)
                        Signature Hash Algorithm Signature: Unknown (8)
                    Signature Algorithm: rsa_pss_pss_sha256 (0x0809)
                        Signature Hash Algorithm Hash: Unknown (8)
                        Signature Hash Algorithm Signature: Unknown (9)
                    Signature Algorithm: rsa_pss_pss_sha384 (0x080a)
                        Signature Hash Algorithm Hash: Unknown (8)
                        Signature Hash Algorithm Signature: Unknown (10)
                    Signature Algorithm: rsa_pss_pss_sha512 (0x080b)
                        Signature Hash Algorithm Hash: Unknown (8)
                        Signature Hash Algorithm Signature: Unknown (11)
                    Signature Algorithm: rsa_pss_rsae_sha256 (0x0804)
                        Signature Hash Algorithm Hash: Unknown (8)
                        Signature Hash Algorithm Signature: SM2 (4)
                    Signature Algorithm: rsa_pss_rsae_sha384 (0x0805)
                        Signature Hash Algorithm Hash: Unknown (8)
                        Signature Hash Algorithm Signature: Unknown (5)
                    Signature Algorithm: rsa_pss_rsae_sha512 (0x0806)
