=== GRAB TRAFFIC ANALYSIS REPORT ===
Timestamp: Mon Mar 30 12:16:43 UTC 2026
Frame 1: 80 bytes on wire (640 bits), 80 bytes captured (640 bits)
    Encapsulation type: Linux cooked-mode capture v2 (210)
    Arrival Time: Mar 30, 2026 12:16:37.790425000 UTC
    UTC Arrival Time: Mar 30, 2026 12:16:37.790425000 UTC
    Epoch Arrival Time: 1774872997.790425000
    [Time shift for this packet: 0.000000000 seconds]
    [Time delta from previous captured frame: 0.000000000 seconds]
    [Time delta from previous displayed frame: 0.000000000 seconds]
    [Time since reference or first frame: 0.000000000 seconds]
    Frame Number: 1
    Frame Length: 80 bytes (640 bits)
    Capture Length: 80 bytes (640 bits)
    [Frame is marked: False]
    [Frame is ignored: False]
    [Protocols in frame: sll:ethertype:ip:tcp]
Linux cooked capture v2
    Protocol: IPv4 (0x0800)
    Interface index: 2
    Link-layer address type: Ethernet (1)
    Packet type: Sent by us (4)
    Link-layer address length: 6
    Source: Microsoft_ca:3e:d7 (7c:ed:8d:ca:3e:d7)
    Unused: 0000
Internet Protocol Version 4, Src: 10.1.0.218, Dst: 54.251.142.49
    0100 .... = Version: 4
    .... 0101 = Header Length: 20 bytes (5)
    Differentiated Services Field: 0x00 (DSCP: CS0, ECN: Not-ECT)
        0000 00.. = Differentiated Services Codepoint: Default (0)
        .... ..00 = Explicit Congestion Notification: Not ECN-Capable Transport (0)
    Total Length: 60
    Identification: 0xf65d (63069)
    010. .... = Flags: 0x2, Don't fragment
        0... .... = Reserved bit: Not set
        .1.. .... = Don't fragment: Set
        ..0. .... = More fragments: Not set
    ...0 0000 0000 0000 = Fragment Offset: 0
    Time to Live: 64
    Protocol: TCP (6)
    Header Checksum: 0x7457 [validation disabled]
    [Header checksum status: Unverified]
    Source Address: 10.1.0.218
    Destination Address: 54.251.142.49
Transmission Control Protocol, Src Port: 43628, Dst Port: 443, Seq: 0, Len: 0
    Source Port: 43628
    Destination Port: 443
    [Stream index: 0]
    [Conversation completeness: Incomplete (0)]
        ..0. .... = RST: Absent
        ...0 .... = FIN: Absent
        .... 0... = Data: Absent
        .... .0.. = ACK: Absent
        .... ..0. = SYN-ACK: Absent
        .... ...0 = SYN: Absent
        [Completeness Flags: [ Null ]]
    [TCP Segment Len: 0]
    Sequence Number: 0    (relative sequence number)
    Sequence Number (raw): 3695716250
    [Next Sequence Number: 1    (relative sequence number)]
    Acknowledgment Number: 0
    Acknowledgment number (raw): 0
    1010 .... = Header Length: 40 bytes (10)
    Flags: 0x002 (SYN)
        000. .... .... = Reserved: Not set
        ...0 .... .... = Accurate ECN: Not set
        .... 0... .... = Congestion Window Reduced: Not set
        .... .0.. .... = ECN-Echo: Not set
        .... ..0. .... = Urgent: Not set
        .... ...0 .... = Acknowledgment: Not set
        .... .... 0... = Push: Not set
        .... .... .0.. = Reset: Not set
        .... .... ..1. = Syn: Set
            [Expert Info (Chat/Sequence): Connection establish request (SYN): server port 443]
                [Connection establish request (SYN): server port 443]
                [Severity level: Chat]
                [Group: Sequence]
        .... .... ...0 = Fin: Not set
        [TCP Flags: ··········S·]
    Window: 64240
    [Calculated window size: 64240]
    Checksum: 0xd035 [unverified]
    [Checksum Status: Unverified]
    Urgent Pointer: 0
    Options: (20 bytes), Maximum segment size, SACK permitted, Timestamps, No-Operation (NOP), Window scale
        TCP Option - Maximum segment size: 1460 bytes
            Kind: Maximum Segment Size (2)
            Length: 4
            MSS Value: 1460
        TCP Option - SACK permitted
            Kind: SACK Permitted (4)
            Length: 2
        TCP Option - Timestamps
            Kind: Time Stamp Option (8)
            Length: 10
            Timestamp value: 2631303309: TSval 2631303309, TSecr 0
            Timestamp echo reply: 0
        TCP Option - No-Operation (NOP)
            Kind: No-Operation (1)
        TCP Option - Window scale: 10 (multiply by 1024)
            Kind: Window Scale (3)
            Length: 3
            Shift count: 10
            [Multiplier: 1024]
    [Timestamps]
        [Time since first frame in this TCP stream: 0.000000000 seconds]
        [Time since previous frame in this TCP stream: 0.000000000 seconds]

0000  08 00 00 00 00 00 00 02 00 01 04 06 7c ed 8d ca   ............|...
0010  3e d7 00 00 45 00 00 3c f6 5d 40 00 40 06 74 57   >...E..<.]@.@.tW
0020  0a 01 00 da 36 fb 8e 31 aa 6c 01 bb dc 48 27 9a   ....6..1.l...H'.
0030  00 00 00 00 a0 02 fa f0 d0 35 00 00 02 04 05 b4   .........5......
0040  04 02 08 0a 9c d6 80 8d 00 00 00 00 01 03 03 0a   ................

Frame 2: 80 bytes on wire (640 bits), 80 bytes captured (640 bits)
    Encapsulation type: Linux cooked-mode capture v2 (210)
    Arrival Time: Mar 30, 2026 12:16:37.790428000 UTC
    UTC Arrival Time: Mar 30, 2026 12:16:37.790428000 UTC
    Epoch Arrival Time: 1774872997.790428000
    [Time shift for this packet: 0.000000000 seconds]
    [Time delta from previous captured frame: 0.000003000 seconds]
    [Time delta from previous displayed frame: 0.000003000 seconds]
    [Time since reference or first frame: 0.000003000 seconds]
    Frame Number: 2
    Frame Length: 80 bytes (640 bits)
    Capture Length: 80 bytes (640 bits)
    [Frame is marked: False]
    [Frame is ignored: False]
    [Protocols in frame: sll:ethertype:ip:tcp]
Linux cooked capture v2
    Protocol: IPv4 (0x0800)
    Interface index: 3
    Link-layer address type: Ethernet (1)
    Packet type: Sent by us (4)
    Link-layer address length: 6
    Source: Microsoft_ca:3e:d7 (7c:ed:8d:ca:3e:d7)
    Unused: 0000
Internet Protocol Version 4, Src: 10.1.0.218, Dst: 54.251.142.49
    0100 .... = Version: 4
    .... 0101 = Header Length: 20 bytes (5)
    Differentiated Services Field: 0x00 (DSCP: CS0, ECN: Not-ECT)
        0000 00.. = Differentiated Services Codepoint: Default (0)
        .... ..00 = Explicit Congestion Notification: Not ECN-Capable Transport (0)
    Total Length: 60
    Identification: 0xf65d (63069)
    010. .... = Flags: 0x2, Don't fragment
        0... .... = Reserved bit: Not set
        .1.. .... = Don't fragment: Set
        ..0. .... = More fragments: Not set
    ...0 0000 0000 0000 = Fragment Offset: 0
    Time to Live: 64
    Protocol: TCP (6)
    Header Checksum: 0x7457 [validation disabled]
    [Header checksum status: Unverified]
    Source Address: 10.1.0.218
    Destination Address: 54.251.142.49
Transmission Control Protocol, Src Port: 43628, Dst Port: 443, Seq: 0, Len: 0
    Source Port: 43628
    Destination Port: 443
    [Stream index: 0]
    [Conversation completeness: Incomplete, SYN_SENT (1)]
        ..0. .... = RST: Absent
        ...0 .... = FIN: Absent
        .... 0... = Data: Absent
        .... .0.. = ACK: Absent
        .... ..0. = SYN-ACK: Absent
        .... ...1 = SYN: Present
        [Completeness Flags: ·····S]
    [TCP Segment Len: 0]
    Sequence Number: 0    (relative sequence number)
    Sequence Number (raw): 3695716250
    [Next Sequence Number: 1    (relative sequence number)]
    Acknowledgment Number: 0
    Acknowledgment number (raw): 0
    1010 .... = Header Length: 40 bytes (10)
    Flags: 0x002 (SYN)
        000. .... .... = Reserved: Not set
        ...0 .... .... = Accurate ECN: Not set
        .... 0... .... = Congestion Window Reduced: Not set
        .... .0.. .... = ECN-Echo: Not set
        .... ..0. .... = Urgent: Not set
        .... ...0 .... = Acknowledgment: Not set
        .... .... 0... = Push: Not set
        .... .... .0.. = Reset: Not set
        .... .... ..1. = Syn: Set
            [Expert Info (Chat/Sequence): Connection establish request (SYN): server port 443]
                [Connection establish request (SYN): server port 443]
                [Severity level: Chat]
                [Group: Sequence]
        .... .... ...0 = Fin: Not set
        [TCP Flags: ··········S·]
    Window: 64240
    [Calculated window size: 64240]
    Checksum: 0xd035 [unverified]
    [Checksum Status: Unverified]
    Urgent Pointer: 0
    Options: (20 bytes), Maximum segment size, SACK permitted, Timestamps, No-Operation (NOP), Window scale
        TCP Option - Maximum segment size: 1460 bytes
            Kind: Maximum Segment Size (2)
            Length: 4
            MSS Value: 1460
        TCP Option - SACK permitted
            Kind: SACK Permitted (4)
            Length: 2
        TCP Option - Timestamps
            Kind: Time Stamp Option (8)
            Length: 10
            Timestamp value: 2631303309: TSval 2631303309, TSecr 0
            Timestamp echo reply: 0
        TCP Option - No-Operation (NOP)
            Kind: No-Operation (1)
        TCP Option - Window scale: 10 (multiply by 1024)
            Kind: Window Scale (3)
            Length: 3
            Shift count: 10
            [Multiplier: 1024]
    [Timestamps]
        [Time since first frame in this TCP stream: 0.000003000 seconds]
        [Time since previous frame in this TCP stream: 0.000003000 seconds]
    [SEQ/ACK analysis]
        [TCP Analysis Flags]
            [Expert Info (Note/Sequence): This frame is a (suspected) retransmission]
                [This frame is a (suspected) retransmission]
                [Severity level: Note]
                [Group: Sequence]
            [The RTO for this segment was: 0.000003000 seconds]
            [RTO based on delta from frame: 1]

0000  08 00 00 00 00 00 00 03 00 01 04 06 7c ed 8d ca   ............|...
0010  3e d7 00 00 45 00 00 3c f6 5d 40 00 40 06 74 57   >...E..<.]@.@.tW
0020  0a 01 00 da 36 fb 8e 31 aa 6c 01 bb dc 48 27 9a   ....6..1.l...H'.
0030  00 00 00 00 a0 02 fa f0 d0 35 00 00 02 04 05 b4   .........5......
0040  04 02 08 0a 9c d6 80 8d 00 00 00 00 01 03 03 0a   ................

Frame 3: 80 bytes on wire (640 bits), 80 bytes captured (640 bits)
    Encapsulation type: Linux cooked-mode capture v2 (210)
    Arrival Time: Mar 30, 2026 12:16:37.997102000 UTC
    UTC Arrival Time: Mar 30, 2026 12:16:37.997102000 UTC
    Epoch Arrival Time: 1774872997.997102000
    [Time shift for this packet: 0.000000000 seconds]
    [Time delta from previous captured frame: 0.206674000 seconds]
    [Time delta from previous displayed frame: 0.206674000 seconds]
    [Time since reference or first frame: 0.206677000 seconds]
    Frame Number: 3
    Frame Length: 80 bytes (640 bits)
    Capture Length: 80 bytes (640 bits)
    [Frame is marked: False]
    [Frame is ignored: False]
    [Protocols in frame: sll:ethertype:ip:tcp]
Linux cooked capture v2
    Protocol: IPv4 (0x0800)
    Interface index: 2
    Link-layer address type: Ethernet (1)
    Packet type: Unicast to us (0)
    Link-layer address length: 6
    Source: 12:34:56:78:9a:bc (12:34:56:78:9a:bc)
    Unused: 0000
Internet Protocol Version 4, Src: 54.251.142.49, Dst: 10.1.0.218
    0100 .... = Version: 4
    .... 0101 = Header Length: 20 bytes (5)
    Differentiated Services Field: 0x00 (DSCP: CS0, ECN: Not-ECT)
        0000 00.. = Differentiated Services Codepoint: Default (0)
        .... ..00 = Explicit Congestion Notification: Not ECN-Capable Transport (0)
    Total Length: 60
    Identification: 0x0000 (0)
    010. .... = Flags: 0x2, Don't fragment
        0... .... = Reserved bit: Not set
        .1.. .... = Don't fragment: Set
        ..0. .... = More fragments: Not set
    ...0 0000 0000 0000 = Fragment Offset: 0
    Time to Live: 238
    Protocol: TCP (6)
    Header Checksum: 0xbcb4 [validation disabled]
    [Header checksum status: Unverified]
    Source Address: 54.251.142.49
    Destination Address: 10.1.0.218
Transmission Control Protocol, Src Port: 443, Dst Port: 43628, Seq: 0, Ack: 1, Len: 0
    Source Port: 443
    Destination Port: 43628
    [Stream index: 0]
    [Conversation completeness: Incomplete, SYN_SENT (1)]
        ..0. .... = RST: Absent
        ...0 .... = FIN: Absent
        .... 0... = Data: Absent
        .... .0.. = ACK: Absent
        .... ..0. = SYN-ACK: Absent
        .... ...1 = SYN: Present
        [Completeness Flags: ·····S]
    [TCP Segment Len: 0]
    Sequence Number: 0    (relative sequence number)
    Sequence Number (raw): 2371871353
    [Next Sequence Number: 1    (relative sequence number)]
    Acknowledgment Number: 1    (relative ack number)
    Acknowledgment number (raw): 3695716251
    1010 .... = Header Length: 40 bytes (10)
    Flags: 0x012 (SYN, ACK)
        000. .... .... = Reserved: Not set
        ...0 .... .... = Accurate ECN: Not set
        .... 0... .... = Congestion Window Reduced: Not set
        .... .0.. .... = ECN-Echo: Not set
        .... ..0. .... = Urgent: Not set
        .... ...1 .... = Acknowledgment: Set
        .... .... 0... = Push: Not set
        .... .... .0.. = Reset: Not set
        .... .... ..1. = Syn: Set
            [Expert Info (Chat/Sequence): Connection establish acknowledge (SYN+ACK): server port 443]
                [Connection establish acknowledge (SYN+ACK): server port 443]
                [Severity level: Chat]
                [Group: Sequence]
        .... .... ...0 = Fin: Not set
        [TCP Flags: ·······A··S·]
    Window: 26847
    [Calculated window size: 26847]
    Checksum: 0xb4f3 [unverified]
    [Checksum Status: Unverified]
    Urgent Pointer: 0
    Options: (20 bytes), Maximum segment size, SACK permitted, Timestamps, No-Operation (NOP), Window scale
        TCP Option - Maximum segment size: 1460 bytes
            Kind: Maximum Segment Size (2)
            Length: 4
            MSS Value: 1460
        TCP Option - SACK permitted
            Kind: SACK Permitted (4)
            Length: 2
        TCP Option - Timestamps
            Kind: Time Stamp Option (8)
            Length: 10
            Timestamp value: 1638120232: TSval 1638120232, TSecr 2631303309
            Timestamp echo reply: 2631303309
        TCP Option - No-Operation (NOP)
            Kind: No-Operation (1)
        TCP Option - Window scale: 8 (multiply by 256)
            Kind: Window Scale (3)
            Length: 3
            Shift count: 8
            [Multiplier: 256]
    [Timestamps]
        [Time since first frame in this TCP stream: 0.206677000 seconds]
        [Time since previous frame in this TCP stream: 0.206674000 seconds]
    [SEQ/ACK analysis]
        [This is an ACK to the segment in frame: 1]
        [The RTT to ACK the segment was: 0.206677000 seconds]

0000  08 00 00 00 00 00 00 02 00 01 00 06 12 34 56 78   .............4Vx
0010  9a bc 00 00 45 00 00 3c 00 00 40 00 ee 06 bc b4   ....E..<..@.....
0020  36 fb 8e 31 0a 01 00 da 01 bb aa 6c 8d 5f e2 79   6..1.......l._.y
0030  dc 48 27 9b a0 12 68 df b4 f3 00 00 02 04 05 b4   .H'...h.........
0040  04 02 08 0a 61 a3 bb 28 9c d6 80 8d 01 03 03 08   ....a..(........

Frame 4: 72 bytes on wire (576 bits), 72 bytes captured (576 bits)
    Encapsulation type: Linux cooked-mode capture v2 (210)
    Arrival Time: Mar 30, 2026 12:16:37.997152000 UTC
    UTC Arrival Time: Mar 30, 2026 12:16:37.997152000 UTC
    Epoch Arrival Time: 1774872997.997152000
    [Time shift for this packet: 0.000000000 seconds]
    [Time delta from previous captured frame: 0.000050000 seconds]
    [Time delta from previous displayed frame: 0.000050000 seconds]
    [Time since reference or first frame: 0.206727000 seconds]
    Frame Number: 4
    Frame Length: 72 bytes (576 bits)
    Capture Length: 72 bytes (576 bits)
    [Frame is marked: False]
    [Frame is ignored: False]
    [Protocols in frame: sll:ethertype:ip:tcp]
Linux cooked capture v2
    Protocol: IPv4 (0x0800)
    Interface index: 2
    Link-layer address type: Ethernet (1)
    Packet type: Sent by us (4)
    Link-layer address length: 6
    Source: Microsoft_ca:3e:d7 (7c:ed:8d:ca:3e:d7)
    Unused: 0000
Internet Protocol Version 4, Src: 10.1.0.218, Dst: 54.251.142.49
    0100 .... = Version: 4
    .... 0101 = Header Length: 20 bytes (5)
    Differentiated Services Field: 0x00 (DSCP: CS0, ECN: Not-ECT)
        0000 00.. = Differentiated Services Codepoint: Default (0)
        .... ..00 = Explicit Congestion Notification: Not ECN-Capable Transport (0)
    Total Length: 52
    Identification: 0xf65e (63070)
    010. .... = Flags: 0x2, Don't fragment
        0... .... = Reserved bit: Not set
        .1.. .... = Don't fragment: Set
        ..0. .... = More fragments: Not set
    ...0 0000 0000 0000 = Fragment Offset: 0
    Time to Live: 64
    Protocol: TCP (6)
    Header Checksum: 0x745e [validation disabled]
    [Header checksum status: Unverified]
    Source Address: 10.1.0.218
    Destination Address: 54.251.142.49
Transmission Control Protocol, Src Port: 43628, Dst Port: 443, Seq: 1, Ack: 1, Len: 0
    Source Port: 43628
    Destination Port: 443
    [Stream index: 0]
    [Conversation completeness: Incomplete, CLIENT_ESTABLISHED (3)]
        ..0. .... = RST: Absent
        ...0 .... = FIN: Absent
        .... 0... = Data: Absent
        .... .0.. = ACK: Absent
        .... ..1. = SYN-ACK: Present
        .... ...1 = SYN: Present
        [Completeness Flags: ····SS]
    [TCP Segment Len: 0]
    Sequence Number: 1    (relative sequence number)
    Sequence Number (raw): 3695716251
    [Next Sequence Number: 1    (relative sequence number)]
    Acknowledgment Number: 1    (relative ack number)
    Acknowledgment number (raw): 2371871354
    1000 .... = Header Length: 32 bytes (8)
    Flags: 0x010 (ACK)
        000. .... .... = Reserved: Not set
        ...0 .... .... = Accurate ECN: Not set
        .... 0... .... = Congestion Window Reduced: Not set
        .... .0.. .... = ECN-Echo: Not set
        .... ..0. .... = Urgent: Not set
        .... ...1 .... = Acknowledgment: Set
        .... .... 0... = Push: Not set
        .... .... .0.. = Reset: Not set
        .... .... ..0. = Syn: Not set
        .... .... ...0 = Fin: Not set
        [TCP Flags: ·······A····]
    Window: 63
    [Calculated window size: 64512]
    [Window size scaling factor: 1024]
    Checksum: 0xd02d [unverified]
    [Checksum Status: Unverified]
    Urgent Pointer: 0
    Options: (12 bytes), No-Operation (NOP), No-Operation (NOP), Timestamps
        TCP Option - No-Operation (NOP)
            Kind: No-Operation (1)
        TCP Option - No-Operation (NOP)
            Kind: No-Operation (1)
        TCP Option - Timestamps
            Kind: Time Stamp Option (8)
            Length: 10
            Timestamp value: 2631303515: TSval 2631303515, TSecr 1638120232
            Timestamp echo reply: 1638120232
    [Timestamps]
        [Time since first frame in this TCP stream: 0.206727000 seconds]
        [Time since previous frame in this TCP stream: 0.000050000 seconds]
    [SEQ/ACK analysis]
        [This is an ACK to the segment in frame: 3]
        [The RTT to ACK the segment was: 0.000050000 seconds]
        [iRTT: 0.206724000 seconds]

0000  08 00 00 00 00 00 00 02 00 01 04 06 7c ed 8d ca   ............|...
0010  3e d7 00 00 45 00 00 34 f6 5e 40 00 40 06 74 5e   >...E..4.^@.@.t^
0020  0a 01 00 da 36 fb 8e 31 aa 6c 01 bb dc 48 27 9b   ....6..1.l...H'.
0030  8d 5f e2 7a 80 10 00 3f d0 2d 00 00 01 01 08 0a   ._.z...?.-......
0040  9c d6 81 5b 61 a3 bb 28                           ...[a..(

Frame 5: 72 bytes on wire (576 bits), 72 bytes captured (576 bits)
    Encapsulation type: Linux cooked-mode capture v2 (210)
    Arrival Time: Mar 30, 2026 12:16:37.997156000 UTC
    UTC Arrival Time: Mar 30, 2026 12:16:37.997156000 UTC
    Epoch Arrival Time: 1774872997.997156000
    [Time shift for this packet: 0.000000000 seconds]
    [Time delta from previous captured frame: 0.000004000 seconds]
    [Time delta from previous displayed frame: 0.000004000 seconds]
    [Time since reference or first frame: 0.206731000 seconds]
    Frame Number: 5
    Frame Length: 72 bytes (576 bits)
    Capture Length: 72 bytes (576 bits)
    [Frame is marked: False]
    [Frame is ignored: False]
    [Protocols in frame: sll:ethertype:ip:tcp]
Linux cooked capture v2
    Protocol: IPv4 (0x0800)
    Interface index: 3
    Link-layer address type: Ethernet (1)
    Packet type: Sent by us (4)
    Link-layer address length: 6
    Source: Microsoft_ca:3e:d7 (7c:ed:8d:ca:3e:d7)
    Unused: 0000
Internet Protocol Version 4, Src: 10.1.0.218, Dst: 54.251.142.49
    0100 .... = Version: 4
    .... 0101 = Header Length: 20 bytes (5)
    Differentiated Services Field: 0x00 (DSCP: CS0, ECN: Not-ECT)
        0000 00.. = Differentiated Services Codepoint: Default (0)
        .... ..00 = Explicit Congestion Notification: Not ECN-Capable Transport (0)
    Total Length: 52
    Identification: 0xf65e (63070)
    010. .... = Flags: 0x2, Don't fragment
        0... .... = Reserved bit: Not set
        .1.. .... = Don't fragment: Set
        ..0. .... = More fragments: Not set
    ...0 0000 0000 0000 = Fragment Offset: 0
    Time to Live: 64
    Protocol: TCP (6)
    Header Checksum: 0x745e [validation disabled]
    [Header checksum status: Unverified]
    Source Address: 10.1.0.218
    Destination Address: 54.251.142.49
Transmission Control Protocol, Src Port: 43628, Dst Port: 443, Seq: 1, Ack: 1, Len: 0
    Source Port: 43628
    Destination Port: 443
    [Stream index: 0]
    [Conversation completeness: Incomplete, ESTABLISHED (7)]
        ..0. .... = RST: Absent
        ...0 .... = FIN: Absent
        .... 0... = Data: Absent
        .... .1.. = ACK: Present
        .... ..1. = SYN-ACK: Present
        .... ...1 = SYN: Present
        [Completeness Flags: ···ASS]
    [TCP Segment Len: 0]
    Sequence Number: 1    (relative sequence number)
    Sequence Number (raw): 3695716251
    [Next Sequence Number: 1    (relative sequence number)]
    Acknowledgment Number: 1    (relative ack number)
    Acknowledgment number (raw): 2371871354
    1000 .... = Header Length: 32 bytes (8)
    Flags: 0x010 (ACK)
        000. .... .... = Reserved: Not set
        ...0 .... .... = Accurate ECN: Not set
        .... 0... .... = Congestion Window Reduced: Not set
        .... .0.. .... = ECN-Echo: Not set
        .... ..0. .... = Urgent: Not set
        .... ...1 .... = Acknowledgment: Set
        .... .... 0... = Push: Not set
        .... .... .0.. = Reset: Not set
        .... .... ..0. = Syn: Not set
        .... .... ...0 = Fin: Not set
        [TCP Flags: ·······A····]
    Window: 63
    [Calculated window size: 64512]
    [Window size scaling factor: 1024]
    Checksum: 0xd02d [unverified]
    [Checksum Status: Unverified]
    Urgent Pointer: 0
    Options: (12 bytes), No-Operation (NOP), No-Operation (NOP), Timestamps
        TCP Option - No-Operation (NOP)
            Kind: No-Operation (1)
        TCP Option - No-Operation (NOP)
            Kind: No-Operation (1)
        TCP Option - Timestamps
            Kind: Time Stamp Option (8)
            Length: 10
            Timestamp value: 2631303515: TSval 2631303515, TSecr 1638120232
            Timestamp echo reply: 1638120232
    [Timestamps]
        [Time since first frame in this TCP stream: 0.206731000 seconds]
        [Time since previous frame in this TCP stream: 0.000004000 seconds]
    [SEQ/ACK analysis]
        [iRTT: 0.206724000 seconds]
        [TCP Analysis Flags]
            [This is a TCP duplicate ack]
        [Duplicate ACK #: 1]
        [Duplicate to the ACK in frame: 4]
            [Expert Info (Note/Sequence): Duplicate ACK (#1)]
                [Duplicate ACK (#1)]
                [Severity level: Note]
                [Group: Sequence]

0000  08 00 00 00 00 00 00 03 00 01 04 06 7c ed 8d ca   ............|...
0010  3e d7 00 00 45 00 00 34 f6 5e 40 00 40 06 74 5e   >...E..4.^@.@.t^
0020  0a 01 00 da 36 fb 8e 31 aa 6c 01 bb dc 48 27 9b   ....6..1.l...H'.
0030  8d 5f e2 7a 80 10 00 3f d0 2d 00 00 01 01 08 0a   ._.z...?.-......
0040  9c d6 81 5b 61 a3 bb 28                           ...[a..(

Frame 6: 589 bytes on wire (4712 bits), 589 bytes captured (4712 bits)
    Encapsulation type: Linux cooked-mode capture v2 (210)
    Arrival Time: Mar 30, 2026 12:16:38.018879000 UTC
    UTC Arrival Time: Mar 30, 2026 12:16:38.018879000 UTC
    Epoch Arrival Time: 1774872998.018879000
    [Time shift for this packet: 0.000000000 seconds]
    [Time delta from previous captured frame: 0.021723000 seconds]
    [Time delta from previous displayed frame: 0.021723000 seconds]
    [Time since reference or first frame: 0.228454000 seconds]
    Frame Number: 6
    Frame Length: 589 bytes (4712 bits)
    Capture Length: 589 bytes (4712 bits)
    [Frame is marked: False]
    [Frame is ignored: False]
    [Protocols in frame: sll:ethertype:ip:tcp:tls]
Linux cooked capture v2
    Protocol: IPv4 (0x0800)
    Interface index: 2
    Link-layer address type: Ethernet (1)
    Packet type: Sent by us (4)
    Link-layer address length: 6
    Source: Microsoft_ca:3e:d7 (7c:ed:8d:ca:3e:d7)
    Unused: 0000
Internet Protocol Version 4, Src: 10.1.0.218, Dst: 54.251.142.49
    0100 .... = Version: 4
    .... 0101 = Header Length: 20 bytes (5)
    Differentiated Services Field: 0x00 (DSCP: CS0, ECN: Not-ECT)
        0000 00.. = Differentiated Services Codepoint: Default (0)
        .... ..00 = Explicit Congestion Notification: Not ECN-Capable Transport (0)
    Total Length: 569
    Identification: 0xf65f (63071)
    010. .... = Flags: 0x2, Don't fragment
        0... .... = Reserved bit: Not set
        .1.. .... = Don't fragment: Set
        ..0. .... = More fragments: Not set
    ...0 0000 0000 0000 = Fragment Offset: 0
    Time to Live: 64
    Protocol: TCP (6)
    Header Checksum: 0x7258 [validation disabled]
    [Header checksum status: Unverified]
    Source Address: 10.1.0.218
    Destination Address: 54.251.142.49
Transmission Control Protocol, Src Port: 43628, Dst Port: 443, Seq: 1, Ack: 1, Len: 517
    Source Port: 43628
    Destination Port: 443
    [Stream index: 0]
    [Conversation completeness: Incomplete, ESTABLISHED (7)]
        ..0. .... = RST: Absent
        ...0 .... = FIN: Absent
        .... 0... = Data: Absent
        .... .1.. = ACK: Present
        .... ..1. = SYN-ACK: Present
        .... ...1 = SYN: Present
        [Completeness Flags: ···ASS]
    [TCP Segment Len: 517]
    Sequence Number: 1    (relative sequence number)
    Sequence Number (raw): 3695716251
    [Next Sequence Number: 518    (relative sequence number)]
    Acknowledgment Number: 1    (relative ack number)
    Acknowledgment number (raw): 2371871354
    1000 .... = Header Length: 32 bytes (8)
    Flags: 0x018 (PSH, ACK)
        000. .... .... = Reserved: Not set
        ...0 .... .... = Accurate ECN: Not set
        .... 0... .... = Congestion Window Reduced: Not set
        .... .0.. .... = ECN-Echo: Not set
        .... ..0. .... = Urgent: Not set
        .... ...1 .... = Acknowledgment: Set
        .... .... 1... = Push: Set
        .... .... .0.. = Reset: Not set
        .... .... ..0. = Syn: Not set
        .... .... ...0 = Fin: Not set
        [TCP Flags: ·······AP···]
    Window: 63
    [Calculated window size: 64512]
    [Window size scaling factor: 1024]
    Checksum: 0xd232 [unverified]
    [Checksum Status: Unverified]
    Urgent Pointer: 0
    Options: (12 bytes), No-Operation (NOP), No-Operation (NOP), Timestamps
        TCP Option - No-Operation (NOP)
            Kind: No-Operation (1)
        TCP Option - No-Operation (NOP)
            Kind: No-Operation (1)
        TCP Option - Timestamps
            Kind: Time Stamp Option (8)
            Length: 10
            Timestamp value: 2631303537: TSval 2631303537, TSecr 1638120232
            Timestamp echo reply: 1638120232
    [Timestamps]
        [Time since first frame in this TCP stream: 0.228454000 seconds]
        [Time since previous frame in this TCP stream: 0.021723000 seconds]
    [SEQ/ACK analysis]
        [iRTT: 0.206724000 seconds]
        [Bytes in flight: 517]
        [Bytes sent since last PSH flag: 517]
    TCP payload (517 bytes)
Transport Layer Security
    TLSv1 Record Layer: Handshake Protocol: Client Hello
        Content Type: Handshake (22)
        Version: TLS 1.0 (0x0301)
        Length: 512
        Handshake Protocol: Client Hello
            Handshake Type: Client Hello (1)
            Length: 508
            Version: TLS 1.2 (0x0303)
            Random: 586b58d918bf0aeb48162244650abe4a911b19416c685e6364b10264236f53d2
                GMT Unix Time: Jan  3, 2017 07:55:05.000000000 UTC
                Random Bytes: 18bf0aeb48162244650abe4a911b19416c685e6364b10264236f53d2
            Session ID Length: 32
            Session ID: 2418a78c7d12ab1fc900767f422a49b959685c70aae71373f3aedba99a42f566
            Cipher Suites Length: 36
            Cipher Suites (18 suites)
                Cipher Suite: TLS_AES_256_GCM_SHA384 (0x1302)
                Cipher Suite: TLS_CHACHA20_POLY1305_SHA256 (0x1303)
                Cipher Suite: TLS_AES_128_GCM_SHA256 (0x1301)
                Cipher Suite: TLS_ECDHE_ECDSA_WITH_AES_256_GCM_SHA384 (0xc02c)
                Cipher Suite: TLS_ECDHE_RSA_WITH_AES_256_GCM_SHA384 (0xc030)
                Cipher Suite: TLS_ECDHE_ECDSA_WITH_AES_128_GCM_SHA256 (0xc02b)
                Cipher Suite: TLS_ECDHE_RSA_WITH_AES_128_GCM_SHA256 (0xc02f)
                Cipher Suite: TLS_ECDHE_ECDSA_WITH_CHACHA20_POLY1305_SHA256 (0xcca9)
                Cipher Suite: TLS_ECDHE_RSA_WITH_CHACHA20_POLY1305_SHA256 (0xcca8)
                Cipher Suite: TLS_ECDHE_ECDSA_WITH_AES_256_CBC_SHA384 (0xc024)
                Cipher Suite: TLS_ECDHE_RSA_WITH_AES_256_CBC_SHA384 (0xc028)
                Cipher Suite: TLS_ECDHE_ECDSA_WITH_AES_128_CBC_SHA256 (0xc023)
                Cipher Suite: TLS_ECDHE_RSA_WITH_AES_128_CBC_SHA256 (0xc027)
                Cipher Suite: TLS_DHE_RSA_WITH_AES_256_GCM_SHA384 (0x009f)
                Cipher Suite: TLS_DHE_RSA_WITH_AES_128_GCM_SHA256 (0x009e)
                Cipher Suite: TLS_DHE_RSA_WITH_AES_256_CBC_SHA256 (0x006b)
                Cipher Suite: TLS_DHE_RSA_WITH_AES_128_CBC_SHA256 (0x0067)
                Cipher Suite: TLS_EMPTY_RENEGOTIATION_INFO_SCSV (0x00ff)
            Compression Methods Length: 1
            Compression Methods (1 method)
                Compression Method: null (0)
            Extensions Length: 399
            Extension: server_name (len=29) name=mcd-gateway.grabtaxi.com
                Type: server_name (0)
                Length: 29
                Server Name Indication extension
                    Server Name list length: 27
                    Server Name Type: host_name (0)
                    Server Name length: 24
                    Server Name: mcd-gateway.grabtaxi.com
            Extension: ec_point_formats (len=4)
                Type: ec_point_formats (11)
                Length: 4
                EC point formats Length: 3
                Elliptic curves point formats (3)
                    EC point format: uncompressed (0)
                    EC point format: ansiX962_compressed_prime (1)
                    EC point format: ansiX962_compressed_char2 (2)
            Extension: supported_groups (len=22)
                Type: supported_groups (10)
                Length: 22
                Supported Groups List Length: 20
                Supported Groups (10 groups)
                    Supported Group: x25519 (0x001d)
                    Supported Group: secp256r1 (0x0017)
                    Supported Group: x448 (0x001e)
                    Supported Group: secp521r1 (0x0019)
                    Supported Group: secp384r1 (0x0018)
                    Supported Group: ffdhe2048 (0x0100)
                    Supported Group: ffdhe3072 (0x0101)
                    Supported Group: ffdhe4096 (0x0102)
                    Supported Group: ffdhe6144 (0x0103)
                    Supported Group: ffdhe8192 (0x0104)
            Extension: application_layer_protocol_negotiation (len=11)
                Type: application_layer_protocol_negotiation (16)
                Length: 11
                ALPN Extension Length: 9
                ALPN Protocol
                    ALPN string length: 8
                    ALPN Next Protocol: http/1.1
            Extension: encrypt_then_mac (len=0)
                Type: encrypt_then_mac (22)
                Length: 0
            Extension: extended_master_secret (len=0)
                Type: extended_master_secret (23)
                Length: 0
            Extension: post_handshake_auth (len=0)
                Type: post_handshake_auth (49)
                Length: 0
            Extension: signature_algorithms (len=42)
                Type: signature_algorithms (13)
                Length: 42
                Signature Hash Algorithms Length: 40
                Signature Hash Algorithms (20 algorithms)
                    Signature Algorithm: ecdsa_secp256r1_sha256 (0x0403)
                        Signature Hash Algorithm Hash: SHA256 (4)
                        Signature Hash Algorithm Signature: ECDSA (3)
                    Signature Algorithm: ecdsa_secp384r1_sha384 (0x0503)
                        Signature Hash Algorithm Hash: SHA384 (5)
                        Signature Hash Algorithm Signature: ECDSA (3)
                    Signature Algorithm: ecdsa_secp521r1_sha512 (0x0603)
                        Signature Hash Algorithm Hash: SHA512 (6)
                        Signature Hash Algorithm Signature: ECDSA (3)
                    Signature Algorithm: ed25519 (0x0807)
                        Signature Hash Algorithm Hash: Unknown (8)
                        Signature Hash Algorithm Signature: Unknown (7)
                    Signature Algorithm: ed448 (0x0808)
                        Signature Hash Algorithm Hash: Unknown (8)
                        Signature Hash Algorithm Signature: Unknown (8)
                    Signature Algorithm: rsa_pss_pss_sha256 (0x0809)
                        Signature Hash Algorithm Hash: Unknown (8)
                        Signature Hash Algorithm Signature: Unknown (9)
                    Signature Algorithm: rsa_pss_pss_sha384 (0x080a)
                        Signature Hash Algorithm Hash: Unknown (8)
                        Signature Hash Algorithm Signature: Unknown (10)
                    Signature Algorithm: rsa_pss_pss_sha512 (0x080b)
                        Signature Hash Algorithm Hash: Unknown (8)
                        Signature Hash Algorithm Signature: Unknown (11)
                    Signature Algorithm: rsa_pss_rsae_sha256 (0x0804)
                        Signature Hash Algorithm Hash: Unknown (8)
                        Signature Hash Algorithm Signature: SM2 (4)
                    Signature Algorithm: rsa_pss_rsae_sha384 (0x0805)
                        Signature Hash Algorithm Hash: Unknown (8)
                        Signature Hash Algorithm Signature: Unknown (5)
                    Signature Algorithm: rsa_pss_rsae_sha512 (0x0806)
                        Signature Hash Algorithm Hash: Unknown (8)
                        Signature Hash Algorithm Signature: Unknown (6)
                    Signature Algorithm: rsa_pkcs1_sha256 (0x0401)
                        Signature Hash Algorithm Hash: SHA256 (4)
                        Signature Hash Algorithm Signature: RSA (1)
                    Signature Algorithm: rsa_pkcs1_sha384 (0x0501)
                        Signature Hash Algorithm Hash: SHA384 (5)
                        Signature Hash Algorithm Signature: RSA (1)
                    Signature Algorithm: rsa_pkcs1_sha512 (0x0601)
                        Signature Hash Algorithm Hash: SHA512 (6)
                        Signature Hash Algorithm Signature: RSA (1)
                    Signature Algorithm: SHA224 ECDSA (0x0303)
                        Signature Hash Algorithm Hash: SHA224 (3)
                        Signature Hash Algorithm Signature: ECDSA (3)
                    Signature Algorithm: SHA224 RSA (0x0301)
                        Signature Hash Algorithm Hash: SHA224 (3)
                        Signature Hash Algorithm Signature: RSA (1)
                    Signature Algorithm: SHA224 DSA (0x0302)
                        Signature Hash Algorithm Hash: SHA224 (3)
                        Signature Hash Algorithm Signature: DSA (2)
                    Signature Algorithm: SHA256 DSA (0x0402)
                        Signature Hash Algorithm Hash: SHA256 (4)
                        Signature Hash Algorithm Signature: DSA (2)
                    Signature Algorithm: SHA384 DSA (0x0502)
                        Signature Hash Algorithm Hash: SHA384 (5)
                        Signature Hash Algorithm Signature: DSA (2)
                    Signature Algorithm: SHA512 DSA (0x0602)
                        Signature Hash Algorithm Hash: SHA512 (6)
                        Signature Hash Algorithm Signature: DSA (2)
            Extension: supported_versions (len=5) TLS 1.3, TLS 1.2
                Type: supported_versions (43)
                Length: 5
                Supported Versions length: 4
                Supported Version: TLS 1.3 (0x0304)
                Supported Version: TLS 1.2 (0x0303)
            Extension: psk_key_exchange_modes (len=2)
                Type: psk_key_exchange_modes (45)
                Length: 2
                PSK Key Exchange Modes Length: 1
                PSK Key Exchange Mode: PSK with (EC)DHE key establishment (psk_dhe_ke) (1)
            Extension: key_share (len=38) x25519
                Type: key_share (51)
                Length: 38
                Key Share extension
                    Client Key Share Length: 36
                    Key Share Entry: Group: x25519, Key Exchange length: 32
                        Group: x25519 (29)
                        Key Exchange Length: 32
                        Key Exchange: 347ce673f4f8c089cd8d708e97256c4ccf6a30af437e6cce50f04ebec25fb775
            Extension: padding (len=198)
                Type: padding (21)
                Length: 198
                Padding Data [truncated]: 000000000000000000000000000000000000000000000000000000000000000000000000000000000000000000000000000000000000000000000000000000000000000000000000000000000000000000000000000000000000000000000000000000000000000000000
            [JA4: t13d1812h1_85036bcba153_b26ce05bbdd6]
            [JA4_r [truncated]: t13d1812h1_0067,006b,009e,009f,00ff,1301,1302,1303,c023,c024,c027,c028,c02b,c02c,c02f,c030,cca8,cca9_000a,000b,000d,0015,0016,0017,002b,002d,0031,0033_0403,0503,0603,0807,0808,0809,080a,080b,0804,0805,0806,0401,0501,0601]
            [JA3 Fullstring: 771,4866-4867-4865-49196-49200-49195-49199-52393-52392-49188-49192-49187-49191-159-158-107-103-255,0-11-10-16-22-23-49-13-43-45-51-21,29-23-30-25-24-256-257-258-259-260,0-1-2]
            [JA3: a48c0d5f95b1ef98f560f324fd275da1]

0000  08 00 00 00 00 00 00 02 00 01 04 06 7c ed 8d ca   ............|...
0010  3e d7 00 00 45 00 02 39 f6 5f 40 00 40 06 72 58   >...E..9._@.@.rX
0020  0a 01 00 da 36 fb 8e 31 aa 6c 01 bb dc 48 27 9b   ....6..1.l...H'.
0030  8d 5f e2 7a 80 18 00 3f d2 32 00 00 01 01 08 0a   ._.z...?.2......
0040  9c d6 81 71 61 a3 bb 28 16 03 01 02 00 01 00 01   ...qa..(........
0050  fc 03 03 58 6b 58 d9 18 bf 0a eb 48 16 22 44 65   ...XkX.....H."De
0060  0a be 4a 91 1b 19 41 6c 68 5e 63 64 b1 02 64 23   ..J...Alh^cd..d#
0070  6f 53 d2 20 24 18 a7 8c 7d 12 ab 1f c9 00 76 7f   oS. $...}.....v.
0080  42 2a 49 b9 59 68 5c 70 aa e7 13 73 f3 ae db a9   B*I.Yh\p...s....
0090  9a 42 f5 66 00 24 13 02 13 03 13 01 c0 2c c0 30   .B.f.$.......,.0
00a0  c0 2b c0 2f cc a9 cc a8 c0 24 c0 28 c0 23 c0 27   .+./.....$.(.#.'
00b0  00 9f 00 9e 00 6b 00 67 00 ff 01 00 01 8f 00 00   .....k.g........
00c0  00 1d 00 1b 00 00 18 6d 63 64 2d 67 61 74 65 77   .......mcd-gatew
00d0  61 79 2e 67 72 61 62 74 61 78 69 2e 63 6f 6d 00   ay.grabtaxi.com.
00e0  0b 00 04 03 00 01 02 00 0a 00 16 00 14 00 1d 00   ................
00f0  17 00 1e 00 19 00 18 01 00 01 01 01 02 01 03 01   ................
0100  04 00 10 00 0b 00 09 08 68 74 74 70 2f 31 2e 31   ........http/1.1
